name,address,phone
"Levine Law Firm, APC","2219 Main St, Santa Monica, CA 90405, USA",(818) 600-2873
Prime Pacific Law Firm,"11400 W Olympic Blvd #200, Los Angeles, CA 90064, USA",(877) 485-5840
"The Jacobson Law Firm, LLP","10401 Venice Blvd. #204, Los Angeles, CA 90034, USA",(310) 277-2266
Law Offices of David A. Welch,"4640 Admiralty Way, Marina Del Rey, CA 90292, USA",(310) 968-5585
Law Office of David J Duchrow,"2510 Main St #205, Santa Monica, CA 90405, USA",(310) 452-4900
Law Offices of Jeffrey A. Sklar,"171 Pier Ave #428, Santa Monica, CA 90405, USA",(310) 770-6214
Carol Sobel Law Offices,"3110 Main St #210, Santa Monica, CA 90405, USA",(310) 393-3055
"Law Offices of Roger S. Senders, APC","4264 Overland Ave, Culver City, CA 90230, USA",(310) 815-9788
The Law Offices of Ronald M. Lebow,"12400 Wilshire Blvd #400, Los Angeles, CA 90025, USA",(310) 571-9141
Law Offices of Nicholas R. Allis,"12121 Wilshire Blvd, Los Angeles, CA 90025, USA",(310) 207-9400
Selarz Law,"11777 San Vicente Blvd #702, Los Angeles, CA 90049, USA",(310) 651-8685
Trope & Trope LLP,"12121 Wilshire Blvd #1325, Los Angeles, CA 90025, USA",(310) 207-8228
Law Offices of Sara A. Weinstein,"11620 Wilshire Blvd #450, Los Angeles, CA 90025, USA",(310) 785-9444
Pacione Law Firm,"8055 W Manchester Ave #600a, Playa Del Rey, CA 90293, USA",(310) 912-9940
Nikki Jacobson,"10401 Venice Blvd. #204, Los Angeles, CA 90034, USA",(310) 277-2266
Swerdloff,"4640 Admiralty Way, Marina Del Rey, CA 90292, USA",(310) 577-9104
Valeria C Velasco Law Offices,"8055 W Manchester Ave # 710, Playa Del Rey, CA 90293, USA",(310) 821-7890
Bridge Legal,"2999 Overland Ave #104, Los Angeles, CA 90064, USA",(888) 576-6988
David P Baker Law Offices,"13915 Panay Way, Marina Del Rey, CA 90292, USA",(310) 821-4177
Steven W Lazarus Law Offices,"4640 Admiralty Way #500, Marina Del Rey, CA 90292, USA",(310) 496-5758
Law Offices Of Richard A. Fleg,"11600 Washington Pl #216a, Los Angeles, CA 90066, USA",(310) 572-6250
"Robin Mashal, Attorney","2121 Ave of the Stars Suite 800, Los Angeles, CA 90067, USA",(310) 286-2000
"Douglas C. Wicks, Attorney","8939 S Sepulveda Blvd, Los Angeles, CA 90045, USA",(310) 578-6528
Law Office of Colmenares & Tomilowitz,"6080 Center Dr 6th Floor, Los Angeles, CA 90045, USA",(213) 444-1900
Ted Thompson Law,"4275 Madison Ave, Culver City, CA 90232, USA",(310) 559-1352
Spaulding Lawfirm,"9696 Culver Blvd # 103, Culver City, CA 90232, USA",(310) 287-3510
"Century City Law Group, APC","2121 Ave of the Stars Suite 800, Los Angeles, CA 90067, USA",(310) 286-2000
Quock,"6080 Center Dr # 600, Los Angeles, CA 90045, USA",(310) 348-8162
"Comstock & Sharpe, Inc.","11100 Washington Blvd, Culver City, CA 90232, USA",(310) 559-8820
